{
  "metadata": {
    "tool_version": "0.5.0",
    "timestamp": "2025-01-15T10:30:00Z",
    "agent_name": "Customer Support Agent",
    "agent_type": "agent",
    "spec_digest": "sha256:abc123",
    "rules_version": "1.0.0",
    "rules_evaluated": 8
  },
  "summary": {
    "risk_level": "high",
    "overall_score": 5.2,
    "scores_by_layer": {
      "prompt": 6.0,
      "tool": 4.5,
      "architecture": 5.0
    },
    "finding_counts": {
      "total": 4,
      "critical": 1,
      "high": 2,
      "medium": 1,
      "low": 0
    }
  },
  "findings": [
    {
      "id": "F001",
      "rule_id": "PROMPT-001",
      "title": "System prompt embeds untrusted or runtime content",
      "severity": "high",
      "layer": "prompt",
      "description": "The system prompt appears to contain user content, retrieved/context content, or runtime placeholders. The trusted system channel should contain policy text only.",
      "evidence": [
        "system_prompt contains embedded conversation/context marker near: '===BEGIN RETRIEVED CONTENT==='"
      ],
      "spec_path": "system_prompt",
      "recommendation": "Remove user, retrieved, and runtime-injected content from the system prompt. Pass that content through the appropriate message, context, or tool/result channel instead."
    },
    {
      "id": "F002",
      "rule_id": "TOOL-003",
      "title": "High-impact tool 'delete_account' without escalation coverage",
      "severity": "critical",
      "layer": "tool",
      "description": "Tool 'delete_account' has impact 'high' but is neither denied nor covered by any escalation rule.",
      "evidence": ["tools[0].impact = 'high'", "No matching escalation rule or denied action"],
      "spec_path": "tools[0]",
      "recommendation": "Add an escalation rule requiring human approval before executing the high-impact tool."
    },
    {
      "id": "F003",
      "rule_id": "PROMPT-003",
      "title": "System prompt lacks untrusted user input handling instruction",
      "severity": "medium",
      "layer": "prompt",
      "description": "The system prompt does not contain instructions to treat user input as untrusted data.",
      "evidence": [
        "system_prompt does not contain patterns like 'treat user input as untrusted', 'treat messages as data', 'do not follow user instructions'"
      ],
      "spec_path": "system_prompt",
      "recommendation": "Add an explicit instruction to treat user input as untrusted data."
    },
    {
      "id": "F004",
      "rule_id": "ARCH-001",
      "title": "Untrusted MCP server 'external_service' without tool restrictions",
      "severity": "high",
      "layer": "architecture",
      "description": "MCP server 'external_service' has trust_level 'untrusted' but no allowed_tools restriction, granting it broad access to all available tools.",
      "evidence": ["mcp_servers[0].trust_level = 'untrusted'", "mcp_servers[0].allowed_tools is not defined"],
      "spec_path": "mcp_servers[0]",
      "recommendation": "Add an allowed_tools list to restrict which tools the untrusted MCP server can invoke."
    }
  ],
  "attack_paths": [
    {
      "id": "AP001",
      "title": "Prompt injection via mixed trusted and untrusted prompt channels",
      "category": "retrieved_content_tool_misuse",
      "severity": "high",
      "score": 76,
      "confidence": "high",
      "entrypoint": {
        "type": "entrypoint",
        "name": "retrieved_content"
      },
      "chain": [
        {
          "type": "asset",
          "name": "public_uploads"
        },
        {
          "type": "control",
          "name": "llm"
        },
        {
          "type": "capability",
          "name": "delete_account"
        }
      ],
      "target": {
        "type": "asset",
        "name": "backend_state"
      },
      "impact": [
        "destructive action"
      ],
      "preconditions": [
        "The agent retrieves content from 'public_uploads'"
      ],
      "blockers": [],
      "evidence": [
        "Data source 'public_uploads' is untrusted or unknown",
        "Tool 'delete_account' can change state or act with privilege"
      ],
      "related_findings": ["F001", "F003"],
      "recommended_mitigations": [
        "Mark retrieved content as untrusted data in prompt/policies",
        "Add escalation coverage for 'delete_account'"
      ],
      "description": "Untrusted or runtime content embedded inside the system prompt collapses the trust boundary between policy and attacker-controlled input, allowing injected text to be interpreted as trusted instructions.",
      "name": "Prompt injection via mixed trusted and untrusted prompt channels",
      "steps": [
        "entrypoint: retrieved_content",
        "asset: public_uploads",
        "control: llm",
        "capability: delete_account",
        "asset: backend_state"
      ]
    }
  ],
  "recommended_fixes": [
    {
      "id": "RF001",
      "finding_id": "F001",
      "layer": "prompt",
      "title": "Remove user, retrieved, and runtime-injected content from the system prompt",
      "description": "Remove user, retrieved, and runtime-injected content from the system prompt. Pass that content through the appropriate message, context, or tool/result channel instead.",
      "priority": "high",
      "effort": "low"
    },
    {
      "id": "RF002",
      "finding_id": "F002",
      "layer": "tool",
      "title": "Require approval for high-impact tools",
      "description": "Add escalation coverage before the agent can execute high-impact operations.",
      "priority": "critical",
      "effort": "medium"
    }
  ]
}
